{
    "$schema": "config.schema.json",
    "api": "baidu",
    "api.appid": "<your appid here>",
    "api.appkey": "<your appkey here>",
    "api.originalLang": "auto",
    "api.targetLang": "zh",
    "processor.input": [
        {
            "regex": "(\r)*\n",
            "replace": " "
        }
    ],
    "processor.output": []
}
